{"$schema":"https://json-schema.org/draft/2020-12/schema","additionalProperties":false,"allOf":[{"if":{"properties":{"structural_status":{"const":"PASS"}},"required":["structural_status"]},"then":{"properties":{"structural_failure_codes":{"maxItems":0}}}},{"if":{"properties":{"structural_status":{"const":"BLOCKED"}},"required":["structural_status"]},"then":{"properties":{"structural_failure_codes":{"minItems":1}}}},{"if":{"properties":{"replica_consistency_status":{"const":"MATCH"}},"required":["replica_consistency_status"]},"then":{"properties":{"replica_consistency":{"properties":{"agreement_count":{"minimum":1},"compared_count":{"minimum":1},"mismatch_count":{"const":0},"mismatch_ordinals":{"maxItems":0}},"required":["agreement_count","compared_count","mismatch_count","mismatch_ordinals"]}}}},{"if":{"properties":{"replica_consistency_status":{"const":"MISMATCH"}},"required":["replica_consistency_status"]},"then":{"properties":{"replica_consistency":{"properties":{"compared_count":{"minimum":1},"mismatch_count":{"minimum":1},"mismatch_ordinals":{"minItems":1}},"required":["compared_count","mismatch_count","mismatch_ordinals"]}}}},{"if":{"properties":{"replica_consistency_status":{"const":"NOT_RUN"}},"required":["replica_consistency_status"]},"then":{"properties":{"replica_consistency":{"properties":{"agreement_count":{"const":0},"compared_count":{"const":0},"mismatch_count":{"const":0},"mismatch_ordinals":{"maxItems":0}},"required":["agreement_count","compared_count","mismatch_count","mismatch_ordinals"]}}}},{"if":{"properties":{"source_v1":{"properties":{"status":{"const":"PASS"}},"required":["status"]}},"required":["source_v1"]},"then":{"properties":{"source_v1":{"properties":{"failure_codes":{"maxItems":0}}}}}},{"if":{"properties":{"source_v1":{"properties":{"status":{"const":"BLOCKED"}},"required":["status"]}},"required":["source_v1"]},"then":{"properties":{"source_v1":{"properties":{"failure_codes":{"minItems":1}}}}}}],"properties":{"authoritative_scoring":{"const":false},"consumer_rule":{"const":"BYTE_IDENTICAL_REPLICA_CONSUMER_MUST_STOP_ON_MISMATCH"},"date":{"const":"2026-08-22"},"qualification_evidence":{"const":false},"regime":{"const":"B"},"replica_consistency":{"additionalProperties":false,"properties":{"agreement_count":{"minimum":0,"type":"integer"},"compared_count":{"minimum":0,"type":"integer"},"mismatch_count":{"minimum":0,"type":"integer"},"mismatch_ordinals":{"items":{"minimum":0,"type":"integer"},"type":"array","uniqueItems":true},"mismatch_ordinals_sha256":{"pattern":"^[0-9a-f]{64}$","type":"string"}},"required":["compared_count","agreement_count","mismatch_count","mismatch_ordinals","mismatch_ordinals_sha256"],"type":"object"},"replica_consistency_status":{"enum":["MATCH","MISMATCH","NOT_RUN"]},"schema_version":{"const":"m4-wsl2-dual-model-probe-two-axis-report-v2"},"scientific_evidence":{"const":false},"source_v1":{"additionalProperties":false,"properties":{"failure_codes":{"items":{"enum":["ACTIVE_DURATION_SHORT","CHILD_PROCESS_FAILURE","CLEANUP_VRAM_NONZERO","DROPPED_WINDOWS","EXECUTIONS_DID_NOT_OVERLAP","FIFO_ORDER_MISMATCH","GPU_TELEMETRY_UNAVAILABLE","INTERNAL_PROBE_FAILURE","MODEL_FILE_IDENTITY_MISMATCH","MODEL_FILE_UNREADABLE","MODEL_ROOT_IDENTITY_MISMATCH","MODEL_ROOT_MISSING","MODEL_ROOT_UNREADABLE","MODEL_ROOTS_NOT_DISTINCT","NO_BACKPRESSURE_OBSERVED","OUTPUT_DIGEST_MISMATCH","PRODUCER_FAILURE","SUPERVISOR_TIMEOUT","SYNTHETIC_FIXTURE_ONLY"]},"type":"array","uniqueItems":true},"sha256":{"pattern":"^[0-9a-f]{64}$","type":"string"},"status":{"enum":["PASS","BLOCKED"]}},"required":["sha256","status","failure_codes"],"type":"object"},"structural_failure_codes":{"items":{"enum":["ACTIVE_DURATION_SHORT","CHILD_PROCESS_FAILURE","CLEANUP_VRAM_NONZERO","DROPPED_WINDOWS","EXECUTIONS_DID_NOT_OVERLAP","FIFO_ORDER_MISMATCH","GPU_TELEMETRY_UNAVAILABLE","INTERNAL_PROBE_FAILURE","MODEL_FILE_IDENTITY_MISMATCH","MODEL_FILE_UNREADABLE","MODEL_ROOT_IDENTITY_MISMATCH","MODEL_ROOT_MISSING","MODEL_ROOT_UNREADABLE","MODEL_ROOTS_NOT_DISTINCT","NO_BACKPRESSURE_OBSERVED","PRODUCER_FAILURE","SUPERVISOR_TIMEOUT","SYNTHETIC_FIXTURE_ONLY"]},"type":"array","uniqueItems":true},"structural_status":{"enum":["PASS","BLOCKED"]},"synthetic_only":{"const":true}},"required":["schema_version","date","regime","synthetic_only","authoritative_scoring","scientific_evidence","qualification_evidence","source_v1","structural_status","structural_failure_codes","replica_consistency_status","replica_consistency","consumer_rule"],"title":"M4 WSL2 dual-model two-axis diagnostic report v2 [PROPOSED]","type":"object"}
