{"authoritative_scoring":false,"consumer_rule":"BYTE_IDENTICAL_REPLICA_CONSUMER_MUST_STOP_ON_MISMATCH","date":"2026-08-22","qualification_evidence":false,"regime":"B","replica_consistency":{"agreement_count":80,"compared_count":164,"mismatch_count":84,"mismatch_ordinals":[0,1,3,4,5,6,14,16,18,20,22,26,28,36,39,49,52,54,57,58,59,63,65,67,70,72,73,75,76,77,79,80,82,87,88,89,91,92,94,95,96,97,98,100,103,104,105,107,108,109,110,111,114,115,116,117,120,121,122,124,126,128,131,132,133,134,135,136,139,140,142,143,144,147,148,149,150,151,152,154,158,159,162,163],"mismatch_ordinals_sha256":"4b18f7f5fecb789398f5bec525e89e63d6cfd2a8b0d41943707526dabbb6c0fa"},"replica_consistency_status":"MISMATCH","schema_version":"m4-wsl2-dual-model-probe-two-axis-report-v2","scientific_evidence":false,"source_v1":{"failure_codes":["OUTPUT_DIGEST_MISMATCH"],"sha256":"7dde0d1587b9205a339776ad04daecfe2bf160e8ecb9ff0504335f91b57a10bc","status":"BLOCKED"},"structural_failure_codes":[],"structural_status":"PASS","synthetic_only":true}
